<?xml version="1.0" encoding="UTF-8"?>
<!DOCTYPE minta SYSTEM "BG_ertodtd.dtd">
<minta>
    <A Aa="ACSA">
        <Ac>
            <Acd></Acd>
            <Ace></Ace>
        </Ac>
    </A>
    <B Ba="YCVA">
        <Bb>
            <Bbx></Bbx>
            <Bby></Bby>
        </Bb>
    </B>
    <C Ca="ADS">
        <Cb></Cb>
    </C>
    <A_B>
        <A_Bc></A_Bc>
    </A_B>
</minta>